<?xml version="1.0" encoding="UTF-8" ?> 
	<rangeValidationConfig xmlns="http://www.openda.org" xmlns:xsi="http://www.w3.org/2001/XMLSchema-instance" xsi:schemaLocation="http://www.openda.org http://schemas.openda.org/rangeValidationConfig.xsd">
	<constraint id="constraint1">
	<constantLimits>
	  <targetExchangeItemIdSuffix>_positive</targetExchangeItemIdSuffix>
    <sourceExchangeItemId>LowerZoneStorage</sourceExchangeItemId>
    <sourceExchangeItemId>InterceptionStorage</sourceExchangeItemId>
    <sourceExchangeItemId>FreeWater</sourceExchangeItemId>
    <sourceExchangeItemId>SoilMoisture</sourceExchangeItemId>
    <sourceExchangeItemId>DrySnow</sourceExchangeItemId>
    <sourceExchangeItemId>UpperZoneStorage</sourceExchangeItemId>
    <sourceExchangeItemId>SurfaceRunoff</sourceExchangeItemId>
    <sourceExchangeItemId>WaterLevel</sourceExchangeItemId>  			    
	  <lowerLimit>0.0001</lowerLimit> 
	</constantLimits>
	</constraint>
  </rangeValidationConfig>